{
  "evidence_id": "EV-AIOS2-PRQUEUE-2026-08-30",
  "task_id": "AIOS2-RUNTIME-002-2026-08-30",
  "timestamp": "2026-08-30T12:30:00Z",
  "agent": "arena-ai-coding-agent",
  "operation": "Integrate the open PR queue of unmerged hardening work, plus release-pipeline and tracking hygiene",
  "scope": "PRs #32-#48, #90, #91, #86, #87, #89, batch/28 (new PR #95), branch cleanup, .github/workflows, .gitignore, data/",
  "result": "VERIFIED",
  "source": "GitHub API merge records, per-merge local full-suite runs, CI runs on every PR head",
  "observed": "Integrated the entire open PR queue (created by prior sessions on 2026-08-27). MERGED after green CI (merge commits, repository convention): #32 (+3 store durability tests; runtime fully superseded by evolution), #36 (draft; +2 regression tests incl. stale-resume fencing, one assertion aligned to current fail-closed lease release), #37 (draft; +2 CAS transition tests), #45 (canonical ToolGateway + tool-idempotency key-to-tool binding hardening + 9 boundary/concurrency/stress tests; epoch-claim design assessed as superseded by main's fencing model, invariants ported), #46 (ADR-003 tool boundary + control-plane route test), #47 (+2 fault-matrix tests), #48 (lost-update fencing ported into main's architecture: autonomous_loop now persists via version-checked transitions instead of blind save; conftest marker classification; branch chaos suite not carried — encodes superseded runtime design), #90 (+journal read lock contract tests), #91 (+journal quarantine coordination tests), #87 (durability: audit reads under lock, README reliability invariants; includes #86 by ancestry), #95 (batch/28 rebased: lease-store parent-dir fsync + 5 lease durability tests), #89 (batch/29: audit shared read lock, 14 new regression suites, runtime hardening). CLOSED as superseded with evidence comments: #42 (empty-diff merge proof), #43, #44 (ancestors of #45), #86 (ancestor of #87). Test count: 258 -> 293. Branch hygiene: content-level analysis of the remaining 44 non-PR branches (byte-identical checks of changed files): 43 deleted (work present in main verbatim or evolved; stale draft tests that fail against main's evolved runtime documented), 1 kept (canonical-execution: a large unlanded architecture initiative — 14 ADRs, sqlite/distributed execution repository, ~30 missing test files — recorded in the backlog for an owner decision). Hygiene: version-release.yml no longer triggers on the version-bump workflow (this caused an empty duplicate release after every merge, e.g. v1.10.0/v1.11.0/v1.2x series); data/*.jsonl runtime journals untracked (created on demand; tests redirect via AIOS2_DATA_DIR).",
  "commit": null,
  "changed_files": [
    ".github/workflows/version-release.yml",
    ".gitignore",
    "tests/test_recovery_outcome.py",
    "runtime/",
    "tests/",
    "docs/",
    ".uasep/"
  ],
  "verification": "Local full suite before every push (final: 293 passed); CI green on every merged PR head (runs 33305729625, 33305873886, 33306009324, 33306213781, 33306285265, 33306340364, 33307339373, 33307390156, 33307450387, 33307547036, 33307623583, 33307693397); main CI green after each merge.",
  "limitations": [],
  "related": [
    "EV-AIOS2-BRANCHHYGIENE-2026-08-30.json",
    "EV-AIOS2-TESTHYGIENE-2026-08-30.json"
  ]
}
